{"$schema":"https://json-schema.org/draft/2020-12/schema","additionalProperties":false,"properties":{"assurance":{"enum":["local_evidence_only","synthetic_local_process_only"]},"cloud_authority":{"const":false},"dependencies":{"additionalProperties":{"pattern":"^[0-9a-f]{64}$","type":"string"},"propertyNames":{"enum":["discovery","target","inventory","selection","preservation","mapping","ownership","atmos","generation","validation","adoption","plan","approval","execute","reconcile","convergence","handoff"]},"type":"object"},"mode":{"enum":["simulation","live"]},"payload":{"type":"object"},"schema_version":{"const":"journey/1.0"},"stage":{"enum":["discovery","target","inventory","selection","preservation","mapping","ownership","atmos","generation","validation","adoption","plan","approval","execute","reconcile","convergence","handoff"]}},"required":["schema_version","stage","mode","assurance","dependencies","payload","cloud_authority"],"title":"Local journey receipt","type":"object"}
