{"assurance":"synthetic_local_process_only","cloud_authority":false,"dependencies":{"adoption":"97e54864ea6a19d5f112228e91bdac4f1add6deaf28c93767dc540bde1277a02","approval":"ad506c983fc9387e04157888f26297aef3ce5b4087c47bd45a4f5f95ea8d3130","atmos":"0b1a2d97203d0549c7395880bd34e9a890b62dae22105b9bf6ae547847cacf6c","convergence":"90cfd29485149325ad569b1cb20f721f022fbdcc5646189f0a5cf58890236e97","discovery":"de7096a143de7e1dc9ef8e61c848ff80c2f52a67929863bc61685edb998b8ba5","execute":"24c5385a65b9f59bda2da65193daa284af2170425b01db6eb7c7dc70f04666d9","generation":"bc08e43d3732f286f9a73ba26e6e9e902b07d948735cd18d5ba5cc9225ac572b","inventory":"09e2265fe0c56c49b2873aee7fcad5c5b7ec64428c00f5b59752a2c09ca8279e","mapping":"2285357e7caad24027007625bd2ee2d640187cc327cac17a5884418b8530f5ed","ownership":"dff5d48ea1e9ef00e03a6e45469c5686984bfac6ee72f36263356fc72be42761","plan":"866174398c77e7ae724cf6887255457a578dfe8dea396fe977332b6e10ef6ffa","preservation":"dab85c36ad9197dd41e49ad37ae45720e721ada4b9920dd35908ff620a503eef","reconcile":"d55c50e5c1b3efa69dfff2fbc4b7a074b921c0ce4ca973b62ce01e2c55f17d58","selection":"9197bf3d8c5ab89e5ed7e0c5380edf348fcec2a3d8174e54ce9bb292b48ccd29","target":"ec8d1ae1dd4cc2caf157ad9aa0ae83cb190c9eddfa9fc8bfd283032d1c138396","validation":"a4793d71fd389d71e15a84cdf865e09ae5fa99792398c37c51f5ef6d0dbcb74a"},"mode":"simulation","payload":{"cloud_execution":false,"convergence_sha256":"9c730f879f96f40bfd727967b4ef5ab64ae660fe2c33d775096eda44757271e7","generation_sha256":"a7748c125aeadf5a336f4e92afe97b3d38ebb054e2ef5603ec24e56e85305923","live_blockers":["provider_not_qualified","authenticated_target_missing","state_backend_not_observed","single_writer_not_verified","protected_cloud_approval_unavailable","cloud_executor_unavailable"],"live_ready":false,"provider_or_atmos_native_execution":false,"scope":"local_simulation_completed","selected_ids":["22222222-2222-4222-8222-222222222222"]},"schema_version":"journey/1.0","stage":"handoff"}
