{"assurance":"local_evidence_only","cloud_authority":false,"dependencies":{"discovery":"de7096a143de7e1dc9ef8e61c848ff80c2f52a67929863bc61685edb998b8ba5","target":"d74e81a04054741887e69ae7739084b299e45f45598a68cd177635e5b81a464e"},"mode":"simulation","payload":{"observed_policy_ids":["10bd368c-bef5-5691-8fd4-235ab85f70b4"],"source_sha256":"1a84806377f6923326340ee4b8c3f530bc6448b2f9b2b7ffc93d8947184f7bc7","synthetic":true},"schema_version":"journey/1.0","stage":"inventory"}
