{"assurance":"local_evidence_only","cloud_authority":false,"dependencies":{"discovery":"de7096a143de7e1dc9ef8e61c848ff80c2f52a67929863bc61685edb998b8ba5","inventory":"09e2265fe0c56c49b2873aee7fcad5c5b7ec64428c00f5b59752a2c09ca8279e","selection":"9197bf3d8c5ab89e5ed7e0c5380edf348fcec2a3d8174e54ce9bb292b48ccd29","target":"ec8d1ae1dd4cc2caf157ad9aa0ae83cb190c9eddfa9fc8bfd283032d1c138396"},"mode":"simulation","payload":{"policies":{"22222222-2222-4222-8222-222222222222":{"independent_preservation_verified":true,"normalized_sha256":"5e6a5ea331f6044ea3ed41d480a1d1b8c25d09897a490c87603786957380aee5"}}},"schema_version":"journey/1.0","stage":"preservation"}
