{"assurance":"synthetic_local_process_only","cloud_authority":false,"dependencies":{"adoption":"ab40e3e22fdba7e6f6b5ef28ed1adf00034105e809de1d8e0f63f750e34e59fb","atmos":"6be69af936fb18912827a70879762a3234fdfe3a5818dd1f519d7f1c478c4c2c","discovery":"de7096a143de7e1dc9ef8e61c848ff80c2f52a67929863bc61685edb998b8ba5","generation":"8d255947d00b87673af357dd69a8209b1b96d96c97d0b8484df03a96f9bb8eae","inventory":"922871ce125528f44e65bbf2f411fb58a47e64d38619867e5e63c148f2c5117e","mapping":"4e83560f733d954c37f29f769ef9c611bffe14161111cfc3243ebf7954a361f9","ownership":"a5b3840b8bb9a90361f4c42721e9179b2c81bf6c2b2a10f6f042f43c53354f34","plan":"b3ade2aedfad2e4213a30bd1b985ceb3da48469d1243681c7527a03d257d3515","preservation":"28cd5fedeb236fd277ec70a9d651ccfc76d1bdc13ebb8f9e9e6ffa351799eebd","selection":"c188556b229206bce227330b007ade7a6ae96fa6119f1ce8019b188d4e496397","target":"d74e81a04054741887e69ae7739084b299e45f45598a68cd177635e5b81a464e","validation":"8969048049cf4a480055cc17e0415df3e435424db3c9ed0a5b19c59be4b64ee6"},"mode":"simulation","payload":{"cloud_authority":false,"grant_persisted":false,"review_sha256":"f7e74ace7438302e2a637ba75b2d551740028a2b0b756f6adbc622ce50f01b65","scope":"simulation_only"},"schema_version":"journey/1.0","stage":"approval"}
