{"assurance":"synthetic_local_process_only","cloud_authority":false,"dependencies":{"adoption":"31f1ddccb523c31299181e1552c1954b7b22e350c30e05157a243fe50e4ad1ea","approval":"1de7a15daf70743ba5b84d2f8e29edffaae2f7d7a5905f975d9ae2ce9028be03","atmos":"0b1a2d97203d0549c7395880bd34e9a890b62dae22105b9bf6ae547847cacf6c","discovery":"de7096a143de7e1dc9ef8e61c848ff80c2f52a67929863bc61685edb998b8ba5","execute":"ed10cb32a86f600110c0481f77f1f83932956a28944c422cb984c2342cb4a9b4","generation":"d1d8a9ea4c37df4815ea7dc334881b230537654e7c27a890ec6da82d27bde180","inventory":"09e2265fe0c56c49b2873aee7fcad5c5b7ec64428c00f5b59752a2c09ca8279e","mapping":"2285357e7caad24027007625bd2ee2d640187cc327cac17a5884418b8530f5ed","ownership":"dff5d48ea1e9ef00e03a6e45469c5686984bfac6ee72f36263356fc72be42761","plan":"7d18d9980f003f9445a5e25e9bff4c1a568c3dcdf4055e1e313f437fa22dd4aa","preservation":"dab85c36ad9197dd41e49ad37ae45720e721ada4b9920dd35908ff620a503eef","selection":"9197bf3d8c5ab89e5ed7e0c5380edf348fcec2a3d8174e54ce9bb292b48ccd29","target":"ec8d1ae1dd4cc2caf157ad9aa0ae83cb190c9eddfa9fc8bfd283032d1c138396","validation":"63283dc6c427a26f2fceacdb7258a70558edf2f81473ee45793a53e69efd686c"},"mode":"simulation","payload":{"assurance":"synthetic_local_process_only","classification":"desired_state_observed","operation_id":"22c87921f93e4a0a8d5c224590a74684","receipt_sha256":"b20c0f3601821018c943e64ef59db8793e6299418d747b4df8d51fa9200827f3","state_sha256":"8437bd55202162002458176cef69a38442858de86dc754108d4be95675d0bf50","value_sha256":"eea2004e6788567848ac77b4bb751675a4f2a075450f0e971f8dae6758512368"},"schema_version":"journey/1.0","stage":"reconcile"}
