{"assurance":"local_evidence_only","cloud_authority":false,"dependencies":{"atmos":"0b1a2d97203d0549c7395880bd34e9a890b62dae22105b9bf6ae547847cacf6c","discovery":"de7096a143de7e1dc9ef8e61c848ff80c2f52a67929863bc61685edb998b8ba5","generation":"d1d8a9ea4c37df4815ea7dc334881b230537654e7c27a890ec6da82d27bde180","inventory":"09e2265fe0c56c49b2873aee7fcad5c5b7ec64428c00f5b59752a2c09ca8279e","mapping":"2285357e7caad24027007625bd2ee2d640187cc327cac17a5884418b8530f5ed","ownership":"dff5d48ea1e9ef00e03a6e45469c5686984bfac6ee72f36263356fc72be42761","preservation":"dab85c36ad9197dd41e49ad37ae45720e721ada4b9920dd35908ff620a503eef","selection":"9197bf3d8c5ab89e5ed7e0c5380edf348fcec2a3d8174e54ce9bb292b48ccd29","target":"ec8d1ae1dd4cc2caf157ad9aa0ae83cb190c9eddfa9fc8bfd283032d1c138396"},"mode":"simulation","payload":{"independent_preservation_verified":true,"native_provider_validated":false,"output_digest":"922a881f90d790603785cdb656db4f6353d1f748a691b5fd613905d0d06369c1","policies":{"22222222-2222-4222-8222-222222222222":{"file_count":19,"manifest_sha256":"3056a5939c6b6a49f0221e229c113225c8a45d14bccecad9ad503c7dace1faba"}},"target_digest":"5c5192a43ad2b333d1e67080e826ccc87a78339ce40ebe2d2e8cead3a5ec1209"},"schema_version":"journey/1.0","stage":"validation"}
